{
  "schema": 1,
  "requirements": [
    {
      "id": "R-migration-format",
      "title": "Migration format is available without source checkout or guessing",
      "statement": {
        "kind": "source",
        "source": {
          "path": "spec/upgrades.md",
          "sha256": "ca8a7d8ea016f42efb619541c652ad79e8d92913d7899e32a7b216bafcb4a134",
          "excerpt": "`upgrade --request-schema` emits the running CLI's migration-request JSON Schema"
        }
      },
      "origin": "spec/upgrades.md",
      "rationale": "Installed agents need the exact maintained format, not binary-string inspection or guessed fields. Structural validation does not establish semantic approval.",
      "configurations": [
        "default"
      ],
      "criteria": [
        {
          "id": "C-migration-format",
          "expected": "The native CLI emits a self-contained maintained schema outside a repository without writes; it rejects use with mutation modes and the schema distinguishes requests from approval claims and unsupported structures."
        }
      ]
    }
  ],
  "verifications": [
    {
      "id": "V-migration-format",
      "target": {
        "path": "crates/opdev-cli/tests/upgrades.rs",
        "sha256": "edf0ddfdbf6f97a43ba880291180a9052b07d3c4d3c9bcfebba54a175b54ec02",
        "excerpt": "fn migration_schema_is_self_contained_read_only_and_not_an_apply_request()"
      },
      "inputs": [
        {
          "path": "crates/opdev-cli/tests/fixtures/doctor-project.yaml",
          "sha256": "f1dd17ba0aae43debe36358f985a76d4eb16ab39ec189e71f3fd6ab17c6507d6",
          "excerpt": "schema:"
        },
        {
          "path": "crates/opdev-cli/Cargo.toml",
          "sha256": "a3778c4ec997580d98346eeb61b1ba9983da3569fe9299689e86ee2da7357073",
          "excerpt": "[package]"
        },
        {
          "path": "Cargo.toml",
          "sha256": "0231e0451a400aa0966856f69924f1cac63dd7bee06a7acf518550e16b34908a",
          "excerpt": "[workspace]"
        },
        {
          "path": "Cargo.lock",
          "sha256": "f1d2d2ade73ae540d17dae233504d5c3a1627a38c474b228c590cd2790a372a1",
          "excerpt": "# This file is automatically @generated by Cargo."
        },
        {
          "path": "rust-toolchain.toml",
          "sha256": "c6af280187b9a9adab09e95461286632c4559fc6f7b0aad935eae5a07517d2f0",
          "excerpt": "[toolchain]"
        },
        {
          "path": "crates/opdev-cli/src/upgrade.rs",
          "sha256": "9209b5718452acabaf3e4edc2aedfb1e26fb55ce0c90cf02a2a641e73d5655c4",
          "excerpt": "fn migration_request_schema()"
        },
        {
          "path": "schema/migration-request.schema.json",
          "sha256": "6f93b2d9d4e4d668ae0ffbb847ec6fdf77d539d849f287dd0781874b3c3620a9",
          "excerpt": "Explicit coordinated project migration request"
        },
        {
          "path": "schema/project.schema.json",
          "sha256": "08893181d5e2c042f525bb89e33d44c132be5f32487a484048e015bf92398a1d",
          "excerpt": "https://opdev.dev/schema/project.json"
        },
        {
          "path": "schema/adoption.schema.json",
          "sha256": "59b3d2b92ad276dc99ed394bc2d5cd87bfff3653621d708b10be85483f76eb6e",
          "excerpt": "OpDev adoption decisions"
        },
        {
          "path": "schema/requirements.schema.json",
          "sha256": "d9185830cbf12d0441186381ceb4a8c1d2d85799651ba2934c84df6fc4c8c17c",
          "excerpt": "https://opdev.dev/schema/requirements.schema.json"
        },
        {
          "path": "schema/policy-pack.schema.json",
          "sha256": "8539d5fc66b78034b770ec4263668dde18e0c0ac2a599dd67e66923f80009e73",
          "excerpt": "https://opdev.dev/schema/policy-pack-v1.json"
        },
        {
          "path": "schema/evidence-archive.schema.json",
          "sha256": "207666ba6d74acc893054af9cb071af1cb045268318d39f0a0ff72eca21444be",
          "excerpt": "https://opdev.dev/schema/evidence-archive-v1.json"
        }
      ],
      "method": {
        "kind": "automated",
        "suite": "check",
        "assurance": "suite"
      }
    }
  ],
  "plans": [
    {
      "id": "P-migration-format-local",
      "criterion": "C-migration-format",
      "configuration": "default",
      "stage": "local",
      "members": [
        {
          "verification": "V-migration-format",
          "assertion": "Checks emitted resources against maintained files, builds the complete validator, validates valid and malformed requests, rejects apply/resume combinations and compares the empty directory before and after.",
          "discriminating_case": "Missing CLI option failed before implementation; unsupported schema, invented approval and cleanup actions cannot validate; no project initialization occurs."
        }
      ],
      "review": {
        "outcome": "passed",
        "reviewer": "Codex (implementing agent, distinct requirement-led review)",
        "reference": "https://gitlab.com/stolenfootball-tools/opdev/-/issues/123#note_4036898774",
        "rationale": "Reviewed the practical-route changes against this mapping: legacy policy keeps its existing dispatcher and semantics; schema 5 is explicit. Actual regression assertions cover the stated observable boundary, not consent or host effectiveness. Existing assertions were retained; changed legacy guidance-copy tests follow the extracted legacy reference and preserve content/path checks. Source-bound inputs refreshed only after this impact review. Suite assurance still does not prove individual-case execution.",
        "subject_sha256": "70dd2d2db6cb289fa7090d042410d510dee796c8978d80915c503e8ebeb40812"
      }
    },
    {
      "id": "P-migration-format-pre",
      "criterion": "C-migration-format",
      "configuration": "default",
      "stage": "pre_merge",
      "members": [
        {
          "verification": "V-migration-format",
          "assertion": "Checks emitted resources against maintained files, builds the complete validator, validates valid and malformed requests, rejects apply/resume combinations and compares the empty directory before and after.",
          "discriminating_case": "Missing CLI option failed before implementation; unsupported schema, invented approval and cleanup actions cannot validate; no project initialization occurs."
        }
      ],
      "review": {
        "outcome": "passed",
        "reviewer": "Codex (implementing agent, distinct requirement-led review)",
        "reference": "https://gitlab.com/stolenfootball-tools/opdev/-/issues/123#note_4036898774",
        "rationale": "Reviewed the practical-route changes against this mapping: legacy policy keeps its existing dispatcher and semantics; schema 5 is explicit. Actual regression assertions cover the stated observable boundary, not consent or host effectiveness. Existing assertions were retained; changed legacy guidance-copy tests follow the extracted legacy reference and preserve content/path checks. Source-bound inputs refreshed only after this impact review. Suite assurance still does not prove individual-case execution.",
        "subject_sha256": "d5a910f7d91f3ae8706dca4db29c404f171cd0e995487a931952ec00dde98bb0"
      }
    },
    {
      "id": "P-migration-format-post",
      "criterion": "C-migration-format",
      "configuration": "default",
      "stage": "post_merge",
      "members": [
        {
          "verification": "V-migration-format",
          "assertion": "Checks emitted resources against maintained files, builds the complete validator, validates valid and malformed requests, rejects apply/resume combinations and compares the empty directory before and after.",
          "discriminating_case": "Missing CLI option failed before implementation; unsupported schema, invented approval and cleanup actions cannot validate; no project initialization occurs."
        }
      ],
      "review": {
        "outcome": "passed",
        "reviewer": "Codex (implementing agent, distinct requirement-led review)",
        "reference": "https://gitlab.com/stolenfootball-tools/opdev/-/issues/123#note_4036898774",
        "rationale": "Reviewed the practical-route changes against this mapping: legacy policy keeps its existing dispatcher and semantics; schema 5 is explicit. Actual regression assertions cover the stated observable boundary, not consent or host effectiveness. Existing assertions were retained; changed legacy guidance-copy tests follow the extracted legacy reference and preserve content/path checks. Source-bound inputs refreshed only after this impact review. Suite assurance still does not prove individual-case execution.",
        "subject_sha256": "e296903bebcbb1c6a16b6654c5e9cc1c4f5e738f783e4f2d95776197b01060de"
      }
    }
  ]
}
